[
  {
    "id": "garbacea-mei-2025",
    "title": "Why is constrained neural language generation particularly challenging?",
    "year": 2025,
    "authors": ["Cristina Garbacea", "Qiaozhu Mei"],
    "venue": "TMLR",
    "publication_status": "peer_reviewed",
    "study_type": ["survey"],
    "url": "https://openreview.net/forum?id=Vwgjk5ysWn",
    "code_url": null,
    "specification": ["lexical", "syntax", "semantic"],
    "representation": ["framework_dependent"],
    "allocation": ["framework_dependent"],
    "placement": ["multi_stage"],
    "rejected_behavior": ["not_reported"],
    "guarantees": ["not_reported"],
    "systems_measurements": ["not_reported"],
    "outcome_measurements": ["not_reported"],
    "review_status": "full_text_screened",
    "evidence_note": "Pilot full-text review: broad constrained-NLG survey spanning decoding, training, prompting, and evaluation; full taxonomy coding pending."
  },
  {
    "id": "geng-et-al-2023-gcd",
    "title": "Grammar-Constrained Decoding for Structured NLP Tasks without Finetuning",
    "year": 2023,
    "authors": ["Saibo Geng", "Martin Josifoski", "Maxime Peyrard", "Robert West"],
    "venue": "EMNLP",
    "publication_status": "peer_reviewed",
    "study_type": ["method", "evaluation"],
    "url": "https://aclanthology.org/2023.emnlp-main.674/",
    "code_url": null,
    "specification": ["syntax"],
    "representation": ["cfg_parser"],
    "allocation": ["local_masking"],
    "placement": ["token"],
    "rejected_behavior": ["mask"],
    "guarantees": ["language_soundness"],
    "systems_measurements": ["not_reported"],
    "outcome_measurements": ["format_validity", "task_accuracy"],
    "review_status": "metadata_verified",
    "evidence_note": "Metadata and abstract checked; representation, guarantee assumptions, and measurements require full-text coding."
  },
  {
    "id": "geng-et-al-2025-jsonschemabench",
    "title": "Generating Structured Outputs from Language Models: Benchmark and Studies",
    "year": 2025,
    "authors": ["Saibo Geng", "Hudson Cooper", "Michal Moskal", "Samuel Jenkins", "Julian Berman", "Nathan Ranchin", "Robert West", "Eric Horvitz", "Harsha Nori"],
    "venue": "arXiv",
    "publication_status": "preprint",
    "study_type": ["benchmark", "evaluation"],
    "url": "https://arxiv.org/abs/2501.10868",
    "code_url": "https://github.com/guidance-ai/jsonschemabench",
    "specification": ["schema"],
    "representation": ["framework_dependent", "provider_undisclosed"],
    "allocation": ["framework_dependent"],
    "placement": ["token"],
    "rejected_behavior": ["not_reported"],
    "guarantees": ["language_soundness"],
    "systems_measurements": ["latency"],
    "outcome_measurements": ["format_validity", "schema_coverage", "task_accuracy"],
    "review_status": "metadata_verified",
    "evidence_note": "Metadata and abstract checked; per-framework coding requires full-text review."
  },
  {
    "id": "lipkin-et-al-2025-awrs",
    "title": "Fast Controlled Generation from Language Models with Adaptive Weighted Rejection Sampling",
    "year": 2025,
    "authors": ["Benjamin Lipkin", "Benjamin LeBrun", "Jacob Hoover Vigly", "Joao Loula", "David R. MacIver", "Li Du", "Jason Eisner", "Ryan Cotterell", "Vikash Mansinghka", "Timothy J. O'Donnell", "Alexander K. Lew", "Tim Vieira"],
    "venue": "COLM",
    "publication_status": "peer_reviewed",
    "study_type": ["method", "theory", "evaluation"],
    "url": "https://openreview.net/forum?id=3BmPSFAdq3",
    "code_url": null,
    "specification": ["lexical", "syntax", "semantic"],
    "representation": ["programmatic"],
    "allocation": ["rejection_sampling", "importance_weighting"],
    "placement": ["token", "sequence"],
    "rejected_behavior": ["resample"],
    "guarantees": ["distribution_fidelity"],
    "systems_measurements": ["latency"],
    "outcome_measurements": ["task_accuracy", "distribution_divergence"],
    "review_status": "metadata_verified",
    "evidence_note": "Metadata and abstract checked; theorem assumptions and domain-specific measurements require full-text coding."
  },
  {
    "id": "schall-demelo-2025-hidden-cost",
    "title": "The Hidden Cost of Structure: How Constrained Decoding Affects Language Model Performance",
    "year": 2025,
    "authors": ["Maximilian Schall", "Gerard de Melo"],
    "venue": "RANLP",
    "publication_status": "peer_reviewed",
    "study_type": ["measurement", "evaluation"],
    "url": "https://aclanthology.org/2025.ranlp-1.124/",
    "code_url": null,
    "specification": ["syntax", "schema"],
    "representation": ["framework_dependent"],
    "allocation": ["local_masking"],
    "placement": ["token"],
    "rejected_behavior": ["mask"],
    "guarantees": ["not_reported"],
    "systems_measurements": ["not_reported"],
    "outcome_measurements": ["format_validity", "task_accuracy"],
    "review_status": "metadata_verified",
    "evidence_note": "Metadata and abstract checked; model/task strata and log-probability analysis require full-text coding."
  },
  {
    "id": "nguyen-et-al-2026-thinking",
    "title": "Thinking Before Constraining: A Unified Decoding Framework for Large Language Models",
    "year": 2026,
    "authors": ["Ngoc Trinh Hung Nguyen", "Alonso Silva", "Laith Zumot", "Liubov Tupikina", "Armen Aghasaryan", "Mehwish Alam"],
    "venue": "arXiv",
    "publication_status": "preprint",
    "study_type": ["method", "evaluation"],
    "url": "https://arxiv.org/abs/2601.07525",
    "code_url": null,
    "specification": ["syntax", "schema"],
    "representation": ["cfg_parser"],
    "allocation": ["local_masking"],
    "placement": ["multi_stage"],
    "rejected_behavior": ["mask"],
    "guarantees": ["language_soundness"],
    "systems_measurements": ["end_to_end_cost"],
    "outcome_measurements": ["format_validity", "task_accuracy"],
    "review_status": "metadata_verified",
    "evidence_note": "Metadata and full HTML overview checked; free reasoning precedes a trigger-based switch to constrained structured output."
  },
  {
    "id": "reddy-et-al-2026-dccd",
    "title": "Draft-Conditioned Constrained Decoding for Structured Generation in LLMs",
    "year": 2026,
    "authors": ["Avinash Reddy", "Thayne T. Walker", "James S. Ide", "Amrit Singh Bedi"],
    "venue": "arXiv",
    "publication_status": "preprint",
    "study_type": ["method", "analysis", "evaluation"],
    "url": "https://arxiv.org/abs/2603.03305",
    "code_url": null,
    "specification": ["syntax", "schema"],
    "representation": ["framework_dependent"],
    "allocation": ["draft_conditioning", "local_masking"],
    "placement": ["multi_stage"],
    "rejected_behavior": ["regenerate"],
    "guarantees": ["language_soundness"],
    "systems_measurements": ["end_to_end_cost"],
    "outcome_measurements": ["format_validity", "task_accuracy"],
    "review_status": "metadata_verified",
    "evidence_note": "Metadata and abstract checked; KL-projection assumptions and exact backends require full-text coding."
  },
  {
    "id": "liu-et-al-2024-need-structured-output",
    "title": "We Need Structured Output: Towards User-centered Constraints on Large Language Model Output",
    "year": 2024,
    "authors": ["Michael Xieyang Liu", "Frederick Liu", "Alexander J. Fiannaca", "Terry Koo", "Lucas Dixon", "Michael Terry", "Carrie J. Cai"],
    "venue": "CHI Extended Abstracts",
    "publication_status": "peer_reviewed",
    "study_type": ["user_study"],
    "url": "https://doi.org/10.1145/3613905.3650756",
    "code_url": null,
    "specification": ["syntax", "schema", "semantic", "policy"],
    "representation": ["framework_dependent"],
    "allocation": ["framework_dependent"],
    "placement": ["multi_stage"],
    "rejected_behavior": ["not_reported"],
    "guarantees": ["not_reported"],
    "systems_measurements": ["not_reported"],
    "outcome_measurements": ["user_outcome"],
    "review_status": "metadata_verified",
    "evidence_note": "Metadata and abstract checked; user study reports 134 use cases from 51 industry professionals."
  }
]
